[
  {
    "id": "6dc2c00b-f435-4fea-887a-5eb16a883794",
    "company": "Test UUID Corp",
    "position": "Software Engineer",
    "description": "Testing UUID format",
    "url": "https://example.com/jobs/uuid",
    "status": "applied",
    "tags": [
      "test",
      "uuid"
    ],
    "createdAt": "2025-04-18T15:15:06.586797-05:00",
    "updatedAt": "2025-04-18T15:15:06.586797-05:00"
  },
  {
    "id": "80b0c03f-54ae-4fb4-ad6b-358afe9fd166",
    "company": "Qima Technologies",
    "position": "Senior Software Engineer",
    "description": "Working as the senior developer for multiple projects. ",
    "url": "https://qima-tech.com",
    "status": "applied",
    "tags": [
      "remote",
      "full-time",
      "senior",
      "go",
      "react"
    ],
    "createdAt": "2025-04-21T06:53:55.984296-05:00",
    "updatedAt": "2025-04-21T06:53:55.984296-05:00"
  }
]